{
  "portInitializerType": "One Port",
  "ports": [
    {
      "name": "Main Port",
      "x": 40,
      "y": 25,
      "usingGridCoordinates": true
    }
  ],
  "market": {
    "type": "Fixed Price Market",
    "priceBySpecies": {
      "Species_0": 10
    }
  },
  "fuel": {
    "gasPriceMaker": "Fixed Gas Price",
    "fuelPrice": 1.2
  }
}
